{
  "schema_version": "1.0",
  "entry_id": "0005",
  "artifact": "00",
  "review_seq": 1,
  "target": {
    "artifact_path": "workspace/articles/f8fe59b49c2e1e/docs/10_each_lore/0005_murasaki_no_kagami/0005_00_sources.json",
    "commit_sha": "3a544e2606c57893285c845693a701c4e62a4755",
    "blob_sha": "655c357688fdbc89e25a4901c5e528e7c40fb95a",
    "reviewed_at": "2026-09-18T15:52:00Z"
  },
  "checks": {
    "source_assessment": {
      "status": "PASS",
      "notes": "日文研・怪異妖怪伝承DBが索引する公刊民俗資料8件をresearch/indirect derivativeとして扱い、一次本文と混同していない。"
    },
    "evidence_integrity": {
      "status": "PASS",
      "notes": "年齢期限、死／不幸、忘却回避、紫地蔵、ピンク鏡、具体的襲撃型を別Evidenceとして保持する。"
    },
    "source_evidence_support": {
      "status": "PASS",
      "notes": "EVD-001〜008は各カード要約の範囲内で、起源や派生順序を追加断定しない。"
    },
    "primary_source_relation": {
      "status": "PASS",
      "notes": "原誌未実見を明示し、DB要約を原誌本文そのものとして扱わない。"
    },
    "earliest_attestation": {
      "status": "PASS",
      "notes": "今回確認した早い公刊採録1998年を起源年へ格上げしない。"
    },
    "uncertainty_preservation": {
      "status": "PASS",
      "notes": "起源、派生順序、対抗型の広がり、具体的襲撃型の位置付けを未確定のまま保持する。"
    }
  },
  "findings": [],
  "verdict": "Pass",
  "review_notes": "Review cycle 001。Source/Evidence関係、不確実性、最古確認と起源の区別を独立監査しPass。"
}
