{
  "schema_version": "1.1",
  "entry_id": "0011",
  "artifact": "00",
  "review_seq": 6,
  "target": {
    "artifact_path": "workspace/articles/f8fe59b49c2e1e/docs/10_each_lore/0011_kokkuri_san/0011_00_sources.json",
    "commit_sha": "54a4cef6844e1da4ca45b206c776bb03106c1fe2",
    "blob_sha": "df4227a271dcc15bb007314c48f61215bcb94a12",
    "reviewed_at": "2026-09-28T15:28:46Z"
  },
  "checks": {
    "source_assessment": {
      "status": "PASS",
      "notes": "SRC-001は査読系学術論文、SRC-002/003は書誌・復刻系確認、SRC-004は学術論文として用途に応じたsource_typeが妥当。"
    },
    "evidence_integrity": {
      "status": "PASS",
      "notes": "EVD-001〜012は手順・歴史・調査分布・競合機序・entry境界・後代擁護派の用途/注意を認識論的地位を保って記録し、研究者整理や擁護派見解を外部事実へ強めていない。"
    },
    "source_evidence_support": {
      "status": "PASS",
      "notes": "SRC-001 p.31は、擁護派が未来予知・判断・心霊探究を賞揚しつつ霊的トラブルへ注意を促したことを支持し、EVD-011/012のparaphraseと整合する。"
    },
    "primary_source_relation": {
      "status": "PASS",
      "notes": "1887年刊行書誌と後代研究による1884年伝播整理を分離し、後代資料を1884年当時の直接一次Evidenceへ格上げしていない。"
    },
    "earliest_attestation": {
      "status": "PASS",
      "notes": "1887年刊行書誌の直接確認と、1884年伝播・1880年代後半流行という後代研究の推定的整理を区別している。"
    },
    "uncertainty_preservation": {
      "status": "PASS",
      "notes": "具体的伝播経路・単一起点、三脚型から文字盤型への移行、作用機序、時代区分、年齢境界、後代用途/注意の初期型への非遡及を明示している。"
    },
    "salient_evidence_completeness": {
      "status": "PASS",
      "notes": "Source上のsalient informationを再監査し、前回欠落していた未来予知・判断・心霊探究という用途と霊的トラブルへの注意はEVD-011/012として追加済み。手順、歴史、variant境界、作用機序、用途・注意、不確実性に新たなsalient omissionは認めない。"
    }
  },
  "findings": [],
  "review_notes": "current Source/Evidenceを独立再レビューし、SRC-001原文（p.31）も確認した。docs/legacyおよび過去Reviewを意味論的な正解として使用していない。",
  "verdict": "Pass"
}
