{"schema_version":"1.1","entry_id":"0178","artifact":"00","review_seq":3,"target":{"artifact_path":"workspace/articles/f8fe59b49c2e1e/docs/10_each_lore/0178_saruyume/0178_00_sources.json","commit_sha":"ee47beb9d4997f84854ae38c9287539ea1a16e91","blob_sha":"39c1975b7b80916153d2581107a15d5e2f93b73b","reviewed_at":"2026-09-21T01:24:00Z"},"checks":{"source_assessment":{"status":"PASS","notes":"SRC-001は保存転載、SRC-002は後代起源検討記事として区別され、資料種別と利用範囲は概ね適切。原投稿・原スレッド未固定も明示されている。"},"evidence_integrity":{"status":"PASS","notes":"既存EVD-001〜007の記述自体は対応Sourceの趣旨と整合し、夢内描写を現実身体被害へ変換する等の過剰主張はない。"},"source_evidence_support":{"status":"PASS","notes":"既存Evidenceは各source_id/locatorに対応し、paraphraseとして支持される。問題は支持不能ではなくsalient informationの抽出不足である。"},"primary_source_relation":{"status":"PASS","notes":"SRC-001をdirect_derivative、SRC-002をindirect_derivativeとして扱い、未固定の原2ちゃんねる投稿・2003年原スレッドを一次資料として誤認していない。"},"earliest_attestation":{"status":"PASS","notes":"2000年保存転載と2003年派生確認を、実際の起源・絶対的初出と同一視していない。"},"uncertainty_preservation":{"status":"PASS","notes":"実夢体験か創作か、再発条件、警告主体、現実身体危害、2003年派生の絶対的初出等について不確実性を保持している。"},"salient_evidence_completeness":{"status":"FINDING","notes":"SRC-001の本文には、(a)乗車前の警告と覚醒可能性を見込んだ意図的乗車、(b)『活けづくり→えぐり出し→挽肉』という固有の処理列と作用主体、(c)4年後に前回の処理段階から連続して再開すること、(d)終端警告の声を覚醒後の部屋で聞いたとする投稿者の主張がある。現行Evidenceはこれらを一般化または脱落させ、特に(d)の夢／覚醒境界を保持していない。"}},"findings":[{"finding_id":"F001","severity":"Moderate","category":"salient_evidence_completeness","summary":"SRC-001の識別的な進行構造と、覚醒後にも聞こえたとされる終端警告がEvidence層で失われている。","rationale":"EVD-002〜006は、乗車前の警告と投稿者の意図的乗車、固有の処理名と順序・作用主体、4年後に前回の処理段階から再開する連続性を大幅に一般化している。さらにSRC-001では投稿者が終端の声を覚醒後の自室で聞いたと主張するが、EVD-006は単に『終端では警告が示される』とし、夢内か覚醒後かというsalientな境界を落としている。SRC-002の後代整理もこの覚醒後の声という主張を再述している。","impact":"Evidenceだけから猿夢の固有モチーフ・反復の連続性・terminal sceneを十分再構成できず、下流Content/Analysisが作用を『夢内に留まる』と記述しても上流欠落を検知できない。D18のbit自体は直ちに変わるとは限らないが、作用境界の説明とsense-makingが歪む。","fix_direction":"SRC-001から、乗車前警告と意図的乗車、固有処理列（過度な残虐描写の逐語再現は不要）、再開位置の連続性、覚醒後の声という投稿者主張を別Evidenceまたは既存Evidenceの拡張として保持する。覚醒後の声は『投稿者の主張で独立確認なし』という確度を併記し、その後Content→Analysisを再評価する。","source_refs":["SRC-001","SRC-002"],"evidence_refs":["EVD-002","EVD-003","EVD-005","EVD-006"]}],"verdict":"Moderate","review_notes":"Source→Evidenceの既存主張の正否とsemantic completenessを分離して監査した。現行Evidenceに入っている範囲は概ね支持されるが、猿夢固有の進行と夢／覚醒境界に影響するsalient meaningが不足している。"}
