{
  "artifact": "00",
  "checks": {
    "earliest_attestation": {
      "notes": "1992年を確認できる収録資料年として保持し、伝承の起源・成立年へ遡及していない。",
      "status": "PASS"
    },
    "evidence_integrity": {
      "notes": "EVD-001/002はカード要約の荒天・農作物被害、弘法大師による小箱への封じ・磐梯明神祭祀を過度に強めずparaphraseしている。EVD-003も1992年を成立年ではなく収録資料年として扱う。",
      "status": "PASS"
    },
    "primary_source_relation": {
      "notes": "SRC-001を一次本文とは扱わずindirect_derivativeとし、1992年『あしなか』原掲載本文とDBカードを混同していない。",
      "status": "PASS"
    },
    "salient_evidence_completeness": {
      "notes": "SRC-001は基礎文献を『あしなか』通巻227号（1992年、論文「天狗・仙人妖怪ばなし」）と特定するが、EVD-003は「1992年の資料に収録」まで抽象化し、媒体種別・文献同定のsalient H情報をEvidence層で保持していない。",
      "status": "FINDING"
    },
    "source_assessment": {
      "notes": "SRC-001は国際日本文化研究センター「怪異・妖怪伝承データベース」の個別カードで、URL・ID・収録資料情報により対象を一意に同定できる。source_type=reliable_secondary_or_research、relation_to_primary=indirect_derivativeもDB要約という実体と整合する。",
      "status": "PASS"
    },
    "source_evidence_support": {
      "notes": "EVD-001〜003の各主張はSRC-001の要約または書誌・地域メタデータで支持される。",
      "status": "PASS"
    },
    "uncertainty_preservation": {
      "notes": "原資料本文未確認、1992年以前の成立・異伝を固定できない制約を保持する。",
      "status": "PASS"
    }
  },
  "entry_id": "0275",
  "findings": [
    {
      "category": "salient_evidence_completeness",
      "evidence_refs": [
        "EVD-003"
      ],
      "finding_id": "F001",
      "fix_direction": "EVD-003または別Evidenceに、確認資料が1992年『あしなか』通巻227号であることを、起源年ではないとの留保を維持して明示する。必要に応じ論文名・頁も保持する。",
      "impact": "後続AnalysisがD02/D03をMAGAZINEとする際、EvidenceではなくSourceメタデータへ直接戻る必要があり、Source→Evidence→Content→Analysisのtraceabilityが切れる。",
      "rationale": "SRC-001カードは執筆者、論文名、誌名『あしなか』、通巻227号、1992年、開始頁8を明示する。一方EVD-003は「1992年の資料に収録」としか保持せず、D02/D03の媒体判定に必要な「雑誌」という意味と文献同定情報をEvidence層から再構成できない。",
      "severity": "Moderate",
      "source_refs": [
        "SRC-001"
      ],
      "summary": "1992年『あしなか』227号という媒体・基礎文献情報がEvidence層で失われている。"
    }
  ],
  "review_notes": "Golden Referenceはsummary/content_unitsの粒度校正だけに用いた。docs/legacyは参照していない。",
  "review_seq": 3,
  "schema_version": "1.1",
  "target": {
    "artifact_path": "workspace/articles/f8fe59b49c2e1e/docs/10_each_lore/0275_bandaisan_tenaga_ashinaga/0275_00_sources.json",
    "blob_sha": "3dc869f6d627b673f495595755c1adaec1bc60fe",
    "commit_sha": "8a61b60aff70bf6e633d91e2610b8f3283690248",
    "reviewed_at": "2026-09-21T01:46:10Z"
  },
  "verdict": "Moderate"
}
