{
  "schema_version": "1.1",
  "entry_id": "0178",
  "artifact": "00",
  "review_seq": 4,
  "target": {
    "artifact_path": "workspace/articles/f8fe59b49c2e1e/docs/10_each_lore/0178_saruyume/0178_00_sources.json",
    "commit_sha": "ee47beb9d4997f84854ae38c9287539ea1a16e91",
    "blob_sha": "39c1975b7b80916153d2581107a15d5e2f93b73b",
    "reviewed_at": "2026-09-21T07:30:00Z"
  },
  "checks": {
    "source_assessment": {
      "status": "PASS",
      "notes": "SRC-001は2000年保存転載、SRC-002は後代起源検討記事として種別と役割を分離しており、資料同定上の重大な混同はない。"
    },
    "evidence_integrity": {
      "status": "PASS",
      "notes": "EVD-001〜007の既存paraphraseは各Sourceの該当箇所と矛盾しない。問題は個々の既存Evidenceの虚偽ではなく、Source上のsalient detailがEvidence母集団から脱落している点である。"
    },
    "source_evidence_support": {
      "status": "PASS",
      "notes": "既存EVD-001〜007の記述自体はSRC-001/002から追跡できる。"
    },
    "primary_source_relation": {
      "status": "PASS",
      "notes": "2000年原2ちゃんねるページを直接固定できていないこと、SRC-001をdirect derivativeとして扱うことを明示し、一次資料と保存転載を同一視していない。"
    },
    "earliest_attestation": {
      "status": "PASS",
      "notes": "2000年8月2日を保存転載で確認できる定点として扱い、実際の起源や絶対的初出へ拡張していない。2003年猿夢＋についても絶対的初出を固定していない。"
    },
    "uncertainty_preservation": {
      "status": "PASS",
      "notes": "原投稿未固定、実夢体験か創作か不明、2003年原スレッド未固定という不確実性は保持されている。"
    },
    "salient_evidence_completeness": {
      "status": "FINDING",
      "notes": "SRC-001本文をSource母集団として再監査すると、現Evidenceは主要筋を保持する一方、発動前の警告と意図的乗車、処理系列の識別可能な具体性、4年後の再開位置、終端音声を覚醒後の現実で聞いたという投稿者自身の主張、および次回の現実死亡予想をEvidence化していない。"
    }
  },
  "findings": [
    {
      "finding_id": "F001",
      "severity": "Moderate",
      "category": "salient_evidence_completeness",
      "summary": "SRC-001の発動条件・反復継続・夢／覚醒境界に関わるsalient detailがEvidence層から脱落している。",
      "rationale": "保存転載本文では、乗車前に危険を予告する放送を聞いたうえで投稿者が覚醒可能だと考えて意図的に乗車すること、危害処理が固有の順序で進むこと、4年後の夢が前回到達点付近から再開すること、二度目の覚醒後に終端音声を『現実で聞いた』と投稿者が主張すること、さらに次回は現実側で死亡し得ると投稿者自身が予想することが区別されている。EVD-002/003/005/006はこれらを一般化し、とくにEVD-006は夢／覚醒境界と予想・事実の認識論的差を保持していない。",
      "impact": "伝承の具体的再構成だけでなく、乗車条件、反復機構、終端状態、D15、D18の再判定可能性に影響する。現Evidenceから下流へ進むと『作用は夢内だけ』という意味を過度に固定し得る。",
      "fix_direction": "SRC-001から、(1) 乗車前警告と投稿者の意図的乗車、(2) 識別に必要な処理系列・作用主体、(3) 4年後の具体的再開位置、(4) 覚醒後に音声を現実で聞いたという投稿者の主張、(5) 次回死亡は確認事実ではなく投稿者の予想であること、を認識論的地位を分けてEvidence化する。現実作用を事実認定せず、あくまで投稿内主張として不確実性を付す。",
      "source_refs": [
        "SRC-001",
        "SRC-002"
      ],
      "evidence_refs": [
        "EVD-002",
        "EVD-003",
        "EVD-005",
        "EVD-006"
      ]
    }
  ],
  "verdict": "Moderate",
  "review_notes": "Source→Evidenceのsalient completenessを独立に再監査。既存Evidenceの真偽と、Source上の重要情報の抽出完全性を分離して判定した。"
}
